{
  "schema": "kel-implementation-plan/0.2",
  "implementation_plan_id": "kel:implementation-plan:q5_valve_shroud:evidence_application_gate",
  "created_utc": "2026-09-14T18:12:53Z",
  "status": "verified",
  "source_change_request_id": "kel:change:q5_valve_shroud:evidence_application_gate",
  "source_change_request_status": "implemented",
  "expert_review_ref": {
    "id": "kel:review:q5_valve_shroud:evidence_application_gate",
    "repo_path": "knowledge/kel/expert_reviews/final/Q5_REVIEW_01_SHROUD_STIFF_EVIDENCE_APPLIED.json"
  },
  "target_layer": "Tools",
  "requirements": [
    "Fail GD-VLV + GD-SH layouts that retrieve but do not apply C1 evidence.",
    "Expose a shroud_stiff_evidence_gate in design workflow reports.",
    "Allow layouts to pass when evidence refs, dimensions basis, position basis, region mapping, and applicability limits are explicit."
  ],
  "changed_paths": [
    "plotters/ils_builder.py",
    "tools/design_rules_v02.py",
    "knowledge/edpr/EDPR_PARSER_PROMPT_RUNTIME.md",
    "knowledge/edpr/EDPR_APF_PARSER_PROMPT.md",
    "knowledge/kel/KEL_LLM_WORKFLOW_INSTRUCTIONS.md",
    "knowledge/kel/KEL_V0_2_DESIGN_GATES.md",
    "tests/kel/test_design_workflow_v02.py"
  ],
  "evidence": [
    "tests/kel/test_design_workflow_v02.py::test_valve_shroud_layout_must_apply_retrieved_c1_evidence"
  ],
  "checklist": [
    {
      "id": "step_1",
      "action": "Add layout-intent validation gap.",
      "status": "complete"
    },
    {
      "id": "step_2",
      "action": "Add plotter design workflow report gate.",
      "status": "complete"
    },
    {
      "id": "step_3",
      "action": "Add EDPR/KEL workflow instructions.",
      "status": "complete"
    },
    {
      "id": "step_4",
      "action": "Add focused regression test.",
      "status": "complete"
    }
  ],
  "tests": [
    "pytest tests/kel/test_design_workflow_v02.py",
    "python -m unittest discover tools \"test_*.py\""
  ],
  "review": {
    "reviewer": "User/domain expert",
    "decision": "accepted",
    "notes": "Approved in session and requested implementation."
  },
  "completion": {
    "implemented_utc": "2026-09-14T18:12:53Z",
    "verified_utc": "2026-09-14T18:12:53Z",
    "implementation_ref": "plotters/ils_builder.py"
  }
}
